{
	"definitions": {
		"name": {
			"title": "Name of Person",
			"type": "object",
			"properties": {
				"firstname": {
					"type": "string",
					"title": "First Name"
				},
				"secondname": {
					"type": "string",
					"title": "Second name"
				},
				"familyname": {
					"type": "string",
					"title": "Family Name"
				}
			},
			"required": [
				"firstname",
				"familyname"
			]
		},
		"phone": {
			"type": "object",
			"properties": {
				"number": {
					"type": "string",
					"title": "Number",
					"description": "Phone-Number"
				},
				"type": {
					"type": "string",
					"title": "Type",
					"description": "Type of number.",
					"enum": [
						"private",
						"bussiness",
						"mobile",
						"fax"
					]
				}
			},
			"required": [
				"number",
				"type"
			]
		},
		"address": {
			"type": "object",
			"properties": {
				"street": {
					"type": "string",
					"title": "Streetname",
					"description": "Name of the street with the number."
				},
				"zip": {
					"type": "string",
					"title": "The zip-code of the city"
				},
				"city": {
					"type": "string",
					"title": "The name of the city"
				},
				"country": {
					"type": "string",
					"enum": [
						"germany",
						"france"
					],
					"title": "The country",
					"default": "germany"
				},
				"type": {
					"type": "string",
					"enum": [
						"residential",
						"bussiness"
					],
					"title": "Type of Adress",
					"default": "Could be residential or bussiness."
				}
			},
			"required": [
				"street",
				"zip",
				"city",
				"country",
				"type"
			]
		}
	},
	"$schema": "http://json-schema.org/draft-06/schema#",
	"$id": "http://example.com/example.json",
	"type": "object",
	"properties": {
		"id": {
			"$id": "/properties/id",
			"type": "integer",
			"title": "Id of Person",
			"examples": [
				1
			]
		},
		"name": {
			"$ref": "#/definitions/name"
		},
		"abbreviation": {
			"$id": "/properties/abbreviation",
			"type": "string",
			"title": "Abbreviation",
			"pattern": "[A-Z]+",
			"examples": [
				"MW"
			]
		},
		"phones": {
			"type": "array",
			"items": {
				"$ref": "#/definitions/phone"
			}
		},
		"adresses": {
			"type": "array",
			"items": {
				"$ref": "#/definitions/address"
			}
		},
		"status": {
			"$id": "/properties/status",
			"type": "string",
			"enum": [
				"active",
				"inactive"
			],
			"title": "Status",
			"examples": [
				"active"
			]
		}
	},
	"required": [
		"id",
		"name"
	]
}
